{
  "schema_version": "0.1-experimental",
  "assurance_case_id": "mncs.remote-water.assurance-case.development-2",
  "candidate_id": "mncs.remote-water.generated-table.v2",
  "release_id": "mncs.remote-water.no-production-release",
  "contract_id": "mncs.remote-water.supervisory-control.v2",
  "environment_id": "mncs.remote-water.digital-twin.development.v2",
  "criticality": "high",
  "applicability_policy_id": "mncs.remote-water.development-only.v2",
  "trust_policy_id": "mncs.remote-water.local-development-trust.v2",
  "contract_profile_id": "mncs.remote-water.contract-profile.v2",
  "mncs": {
    "version": "0.2",
    "level": "MNCS-L5",
    "status": "UNKNOWN",
    "result_id": "mncs.remote-water.future-l5-result.v2",
    "scope_id": "mncs.remote-water.supervisory-control.v2",
    "issues": [
      "No independently controlled protected holdout evaluation has been executed.",
      "This is a development digital twin, not a released operational controller.",
      "Independent water-utility, controls, and safety review remains outstanding."
    ],
    "limitations": [
      "Development and protected-at-execution scenario PASS do not constitute MNCS-L5 PASS.",
      "No physical-system or industrial-protocol evidence is in scope."
    ]
  },
  "mncds": {
    "version": "0.1-draft",
    "profile": "MNCDS-D3",
    "status": "UNKNOWN",
    "result_id": "mncs.remote-water.future-d3-result.v2",
    "scope_id": "mncs.remote-water-control.development-epoch-2",
    "issues": [
      "The evaluator is hash-locked before runtime scenario generation but is not independently controlled.",
      "Release authority and final operational candidate selection are not established."
    ],
    "limitations": [
      "The checked-in preregistration governs a development epoch only.",
      "No D3 process claim is made by this record."
    ]
  },
  "dependencies": [
    {
      "dependency_id": "mncs.remote-water.digital-twin.v2",
      "relation": "runtime",
      "required": true,
      "status": "PASS",
      "claim_id": null,
      "environment_compatible": "PASS",
      "correlation_group": "development-oracle",
      "invalidation_triggers": [
        "Plant dynamics, pump characteristics, timestep, actual-demand accounting, or terminal normalization changes."
      ]
    },
    {
      "dependency_id": "mncs.remote-water.safety-kernel.v1",
      "relation": "interface",
      "required": true,
      "status": "PASS",
      "claim_id": null,
      "environment_compatible": "PASS",
      "correlation_group": "controller-authority-boundary",
      "invalidation_triggers": [
        "Any safety threshold, dwell rule, telemetry rule, disposition reporting, or authority boundary changes."
      ]
    },
    {
      "dependency_id": "mncs.edgestream.telemetry.v1",
      "relation": "data",
      "required": false,
      "status": "PASS",
      "claim_id": "mncs.edgestream-remote-water.integration.development.v1",
      "environment_compatible": "PASS",
      "correlation_group": "isolated-telemetry-integration",
      "invalidation_triggers": [
        "The EdgeStream frame contract, adapter mapping, component identity, or Remote Water telemetry contract changes."
      ]
    },
    {
      "dependency_id": "mncs.remote-water.protected-evaluator-lock.v1",
      "relation": "evaluator",
      "required": true,
      "status": "PASS",
      "claim_id": null,
      "environment_compatible": "PASS",
      "correlation_group": "repository-owner-evaluation",
      "invalidation_triggers": [
        "Any locked evaluator source, threshold, candidate, simulator, or scenario generator changes."
      ]
    },
    {
      "dependency_id": "mncs.remote-water.independent-holdout.v1",
      "relation": "evaluator",
      "required": true,
      "status": "UNKNOWN",
      "claim_id": null,
      "environment_compatible": "UNKNOWN",
      "correlation_group": null,
      "invalidation_triggers": [
        "Holdout disclosure, evaluator change, threshold change, or candidate regeneration."
      ]
    }
  ],
  "authorities": [
    {
      "role": "development repository owner and current evaluator",
      "authority_id": "github:epi13"
    },
    {
      "role": "future independent evaluator",
      "authority_id": "mncs.remote-water.independent-evaluator.unassigned"
    }
  ],
  "unresolved_unknowns": [
    "Independent water-utility and controls-engineering contract review.",
    "Independently controlled protected holdout outcome and evaluator independence.",
    "Real-time behavior and any physical-system calibration.",
    "Any future mapping to a real installation, PLC, SCADA system, or safety policy."
  ],
  "deviations": [
    {
      "requirement": "Independent final evaluation",
      "rationale": "The epoch-2 workflow freezes evaluator identities and generates exact scenarios only after commit on separate x64 and ARM64 virtual machines, but repository ownership and evaluator authority remain correlated.",
      "risk": "Development results may still overestimate generalization or omit domain-specific failure modes."
    }
  ],
  "limitations": [
    "This assurance case intentionally records UNKNOWN rather than promoting development evidence to a formal claim.",
    "The code cannot emit live industrial control traffic and must remain development-only."
  ],
  "freshness": {
    "evaluated_at": "2026-07-27T00:00:00Z",
    "expires_at": null,
    "revalidation_triggers": [
      "Any source, generated planner, contract, scenario generator, threshold, simulator, adapter, or checkpoint change.",
      "Assignment of an independent evaluator or creation of an independently controlled protected holdout.",
      "Any proposal to connect the system to live equipment or industrial protocols."
    ]
  },
  "rollback": {
    "artifact_id": "mncs.remote-water.readable-baseline.v1",
    "procedure_id": "mncs.remote-water.rollback-procedure.v1",
    "test_status": "PASS"
  },
  "replacement": {
    "regeneration_spec_id": "mncs.remote-water.table-generator.v2",
    "owner_id": "github:epi13",
    "retirement_triggers": [
      "Safety invariant failure.",
      "Protected-at-execution or independent-holdout failure.",
      "Contract or environment incompatibility.",
      "A materially simpler implementation satisfies the same accepted requirements."
    ]
  },
  "supersedes": ["mncs.remote-water.assurance-case.development-1"],
  "disposition": {
    "decision": "review_required",
    "policy_id": "mncs.remote-water.development-only.v2",
    "rationale": "The development harness is executable, cross-architecture, and bounded, but formal implementation and process claims remain UNKNOWN."
  },
  "extensions": {
    "mncs.dev:case-study": {
      "name": "Remote Water Resilience Controller",
      "development_epoch": 2
    }
  }
}
